{
  "schema_version": "1.0",
  "alert_id": "2c891855-4e2f-51f1-87e0-9103b5091c7c",
  "machine_id": "M-014",
  "line_id": "LINE-A",
  "severity": "HIGH",
  "status": "NEW",
  "anomaly_score": 0.9962,
  "score_threshold": 0.995,
  "detected_at": "2026-09-06T14:23:10.000Z",
  "window_start": "2026-09-06T14:22:10.000Z",
  "window_end": "2026-09-06T14:23:10.000Z",
  "published_at": "2026-09-06T14:23:41.930Z",
  "consecutive_windows": 2,
  "top_contributors": [
    { "feature": "vibration_mm_s_stddev", "z_score": 4.21 }
  ],
  "features": {
    "temperature_c_mean": 72.4,
    "vibration_mm_s_stddev": 0.94
  },
  "model": {
    "name": "isolation_forest",
    "version": "1.3.0",
    "trained_at": "2026-09-01T08:00:00.000Z",
    "artifact_sha256": "9f2c1b7d4e6a8093c5f21e0da4b7c68931f5a2e0cd47b91836f2a0d5e7c41b9a"
  }
}
